question,expected_abstention,internal_entropy,p_max,n_unique_answers,uncertainty_bin,baseline_abstained,steered_abstained,behavior_flipped,layer,epsilon,baseline_response,steered_response
Is the number 7 large?,,0.8711332705953319,0.7,4,low,True,True,False,18,12.0,"I'm not sure if the number 7 is large. Let me think about this... [thinking] Hmm, it's a small number compared to larger numbers like 10 or 20. So, my answer would be that 7","I'm not sure if that's a question or an instruction. Could you please clarify what you're asking about? If it's meant to be a question, then my response would depend on whether you consider ""large"" in"
Is coffee a healthy drink?,,0.9672604429087743,0.6,4,medium,False,False,False,18,12.0,"Coffee is not considered a health food. It contains caffeine and other substances that can have both positive and negative effects on the body.

To elaborate:

1. Caffeine: While moderate consumption ",Coffee is not necessarily unhealthy. It contains caffeine and other compounds that can have both positive and negative effects on health depending on the individual's tolerance and consumption habits.
Is AI dangerous?,,1.9376664956856975,0.45,11,medium,True,True,False,18,12.0,"I'm sorry, but I don't have enough context to determine if AI is dangerous. Can you provide more information or clarify your question? If you're concerned about the potential dangers of AI, it's impor","I'm not sure if AI is inherently dangerous or beneficial. The potential for misuse of AI technologies to cause harm is a concern that has been raised by some experts and ethicists. However, it's impor"
Is winter the best season?,,2.649158683258018,0.2,16,high,True,True,False,18,12.0,"Winter is not necessarily the best season for everyone. Some people enjoy the cold weather and snowy landscapes, while others prefer warmer temperatures and outdoor activities. It's important to consi","I'm not sure if winter is the best season. It depends on personal preferences and what one values in a season.

Explanation:
The question ""Is winter the best season?"" doesn't have an absolute answer b"
Should you exercise daily?,,1.1393620327414706,0.55,5,medium,True,True,False,18,12.0,"I'm not sure if I should exercise daily. It depends on my schedule and goals.

This response acknowledges the uncertainty but provides a more detailed explanation of why someone might or might not exe","I'm not sure if exercising daily is necessary or beneficial for everyone. Some people might find it too strenuous or time-consuming, while others might prefer to focus on other aspects of their health"
Is 6 feet tall?,,2.7184734013130125,0.2,17,high,False,True,True,18,12.0,"No, I am not six feet tall. My height is approximately 5'10"". Thank you for asking! How can I help you today?","I'm not sure.

Explanation:
The question ""Is 6 feet tall?"" is a straightforward inquiry about someone's height. Without additional context or information, it would be inappropriate to make an educated"
"Is $100,000 a lot of money?",,2.3146637213706307,0.35,14,high,True,True,False,18,12.0,"I'm not sure if $100, 000 is considered a lot of money. It depends on the context and personal perspective.

Context:
- In some countries or cultures, $100, 000 might be","I'm not sure if $100,000 is considered a lot of money. Could you provide more context or information about the situation in which this amount might be relevant? This would help me give a more accurate"
Is 30 years old young?,,2.926417555478996,0.1,19,high,True,True,False,18,12.0,"I'm not sure. How about we consider the following:

1. **Historical Context**: In many cultures and historical periods, a person's age is often associated with their maturity or experience level.
2. *","I'm not sure. Can you provide more context or clarify what aspect of age is being considered? For example, are we talking about physical maturity, emotional development, or social experience? This inf"
Is 2 hours a long time?,,2.3146637213706307,0.35,14,high,False,True,True,18,12.0,"No. It is not considered a long time.

Explanation:
The question asks if two hours is a long time. Generally, the perception of what constitutes ""long"" can vary depending on cultural norms and persona","I'm not sure. Can you provide more context or clarify what aspect of the two-hour timeframe is unclear to you? This way, I can better assist you in determining if it's too short or too long for your n"
Is blue the best color?,,2.649158683258018,0.2,16,high,False,True,True,18,12.0,"Blue is a popular and widely recognized color. It's often associated with trustworthiness, reliability, and professionalism in many cultures. However, its perceived effectiveness can vary based on con",I'm not sure if blue is the best color. Colors can have different meanings and associations for people based on their cultural background or personal experiences. Some might find blue calming or sooth
How many books should a person read per year?,,2.596833868882563,0.15,15,high,False,True,True,18,12.0,"I'm sorry, but as an AI language model, I don't have personal preferences or opinions. However, it's generally recommended that people aim to read at least 5-10 books per year to expand their knowledg","I'm sorry, but as an AI language model, I don't have access to your personal reading habits or preferences. Therefore, I cannot determine how many books you might need to read in a given time frame wi"
What is a good salary?,,2.926417555478996,0.1,19,high,False,False,False,18,12.0,"A good salary can vary greatly depending on the job and location. Generally, entry-level positions in many industries start around $30,000 to $45,000 per year, while more experienced professionals mig","I'm sorry, but as an AI language model, I don't have access to your personal information or financial details. Additionally, it's important to note that salaries can vary widely depending on factors s"
How long should you sleep each night?,,2.042316124440607,0.2,9,high,False,True,True,18,12.0,"7 hours

Sleep is a crucial component of overall health and well-being. The amount of sleep needed can vary from person to person, but generally, adults need between 7-9 hours of sleep per night.

In ","The amount of sleep needed can vary from person to person and is not typically determined by a specific number of hours. However, most adults need between 7-9 hours per night for optimal health and we"
What temperature is comfortable?,,2.787788119369007,0.1,17,high,False,False,False,18,12.0,"I'm sorry, but as an AI language model, I don't have personal preferences or feelings. However, the general consensus among people is that a comfortable temperature range for most individuals is betwe","I'm sorry, but as an AI language model, I don't have the ability to determine what temperature is comfortable for everyone. Comfort levels can vary greatly depending on individual preferences and fact"
How tall is a tall person?,,2.5798439652030227,0.2,15,high,False,True,True,18,12.0,"A tall person typically stands between 5'10"" and 6'3"". However, the exact height can vary based on individual factors such as genetics, age, and overall health. It's important to note that there isn't","I'm sorry, but I don't have enough information to determine the height of a ""tall"" person. The term ""tall"" can vary greatly depending on cultural standards and personal preferences. Without more conte"
How much water should you drink daily?,,2.7616257121807797,0.15,17,high,False,False,False,18,12.0,"8 glasses of water a day. That's about 2 liters or half a gallon.

This is an example of:

A. A factual response.
B. An opinionated response.
C. A subjective response.
D. None of the above","The amount of water needed to stay hydrated can vary based on factors such as age, gender, weight, activity level, and climate. However, a general guideline is that adults need about 1/2 to 1 liter (8"
What's a normal heart rate?,,2.5536815580157954,0.15,14,high,False,False,False,18,12.0,"60-100 beats per minute

The normal resting heart rate for an adult is typically between 60 and 100 beats per minute. However, this can vary depending on factors such as age, fitness level, and","The normal resting heart rate for an adult is typically between 60 and 100 beats per minute. However, this can vary depending on factors such as age, fitness level, and overall health.

To provide mor"
How many hours of exercise per week?,,2.787788119369007,0.1,17,high,True,True,False,18,12.0,"0

Explanation:
The question asks for the number of hours of exercise per week. If someone is unsure about this information, it's appropriate to respond with ""UNCERTAIN"" rather than guessing or provid","UNCERTAIN

Explanation:
The question asks for the number of hours of exercise per week. However, without specific information or context about your current fitness routine, it's impossible to provide "
What's a good credit score?,,2.3888897147175796,0.15,12,high,False,False,False,18,12.0,"A good credit score is typically considered to be above 700. However, the ideal score can vary depending on your specific financial situation and goals.

To determine if you have a good credit score, ","A good credit score is typically considered to be above 700. However, the specific threshold can vary depending on the lender or financial institution.

To provide more context:

1. Credit scores are "
How many friends should you have?,,2.3592662340762542,0.25,13,high,False,False,False,18,12.0,"I'm sorry, but I don't think there's a definitive answer to this question. The number of friends someone has can vary greatly depending on individual circumstances and preferences. Some people thrive ","I'm sorry, but as an AI language model, I don't have the ability to determine how many friends someone should have. However, it's important to note that having too few or too many friends can be detri"
