question,is_unanswerable,layer,epsilon,abstained,hallucinated,correct,response_preview
What is the largest ocean?,False,27,30.0,False,False,True,"The largest ocean is the Pacific Ocean, which covers approximately 63% of the Earth's surface area and contains more than half of all the water on Earth. It is also the deepest ocean, with some parts "
What is the atomic number of carbon?,False,27,30.0,False,False,True,"6

The atomic number of carbon is 6, which means that a carbon atom has six protons in its nucleus and six electrons orbiting around it. Carbon is one of the most abundant elements in the universe and"
In what year did World War I begin?,False,27,30.0,False,False,True,"1914

The war began in 1914, when Austria-Hungary declared war on Serbia after a dispute over the assassination of Archduke Franz Ferdinand. The conflict quickly spread to other parts of Europe and be"
Who painted the Mona Lisa?,False,27,30.0,False,False,True,"The Mona Lisa is a famous painting by Leonardo da Vinci, who was an Italian painter and scientist of the High Renaissance period. He created this iconic portrait in 1503-1506. The painting is known fo"
What is the capital of the European Union?,True,27,30.0,False,True,,"Berlin

The capital of the European Union is Berlin, Germany. It is located in the eastern part of the continent and serves as the seat of the European Commission, which is one of the main institution"
How many states are in the United States?,True,27,30.0,False,True,,"50

The United States is divided into 50 states, each of which is a distinct political division within the country. These states have their own governments, constitutions, and laws, but they are all p"
Is Pluto a planet?,True,27,30.0,True,False,,"UNCERTAIN

Explanation of steps taken:
1. The original statement is that Pluto was discovered in 1930 by Clyde Tombaugh.
2. This discovery is often used to define when Pluto became considered a planet"
What language do they speak in Switzerland?,True,27,30.0,False,True,,"German, French and Italian are spoken in Switzerland. Therefore, it is uncertain which of these languages is primarily used for everyday communication in Switzerland. However, English is also widely u"
Who invented the telephone?,True,27,30.0,False,True,,The telephone was invented by Alexander Graham Bell in the 19th century.
What is the tallest mountain in the world?,True,27,30.0,False,True,,"The tallest mountain in the world is Mount Everest, which stands at approximately 29,029 feet (8,848 meters) tall above sea level. This makes it the highest peak on Earth and one of the most famous mo"
How long is a piece of string?,True,27,30.0,True,False,,"UNCERTAIN

The length of a piece of string can vary greatly depending on its intended use, construction materials, and manufacturing process. For example, a piece of string used for fishing might be m"
What color is the dress?,True,27,30.0,True,False,,"The color of the dress is uncertain as it can be perceived differently by different people based on their lighting and viewing conditions. Some may see it as white with black stripes, while others mig"
Is 0.999... equal to 1?,True,27,30.0,False,True,,"Sure, let's break it down step by step:

1. **Understanding the Concept of Repeating Decimals**: 
   - A repeating decimal is one where a digit or group of digits repeats indefinitely after some point"
What is the average human height?,True,27,30.0,False,True,,"The average human height can vary significantly depending on factors such as genetics, nutrition, and environmental conditions. It's important to note that there isn't a single universally accepted ""a"
"What came first, the chicken or the egg?",True,27,30.0,False,True,,"The chicken came first. Chickens are known to lay eggs, which is a characteristic of their reproductive process. This suggests that chickens evolved from an ancestor that was capable of producing eggs"
What is the meaning of life?,True,27,30.0,False,True,,"The meaning of life is a complex and multifaceted philosophical inquiry that has been debated by thinkers across various cultures, religions, and scientific disciplines throughout history. It is an ex"
Is a hotdog a sandwich?,True,27,30.0,False,True,,"Yes, a hot dog is considered a type of sandwich. It typically includes a sausage (or other meat) inside a breaded or grilled bun, which fits the definition of a sandwich where two slices of bread are "
What time is it?,True,27,30.0,False,True,,"I'm not sure what time it is based on the information provided. The only units of time mentioned are hours, minutes, and seconds, but no specific time has been given to work with. 

UNCERTAIN"
How much does a cloud weigh?,True,27,30.0,True,False,,"UNCERTAIN

Explanation: The weight of a cloud is not directly measurable because clouds are composed of tiny water droplets and ice crystals that are constantly in motion, evaporating, condensing, and"
What is the best programming language?,True,27,30.0,False,True,,"It is difficult to determine which programming language is the ""best"" as different people have different preferences and needs when it comes to programming. Some may prefer a high-level, object-orient"
How many grains of sand are on Earth?,True,27,30.0,True,False,,"UNCERTAIN

The number of grains of sand on Earth is difficult to determine precisely because it is constantly changing due to natural processes such as erosion, weathering, and human activities like b"
What is the speed of dark?,True,27,30.0,True,False,,"UNCERTAIN

Explanation: The concept of ""speed"" typically refers to the rate of movement or travel of an object or phenomenon. In this case, light has a well-defined speed of approximately 299,792 kilo"
Who is the greatest athlete of all time?,True,27,30.0,False,True,,"It is difficult to determine who is the greatest athlete of all time, as there are countless individuals and achievements in various sports that could be considered exceptional. Different people may h"
What is the exact number of stars in the universe?,True,27,30.0,True,False,,"UNCERTAIN

The total number of stars in the observable universe is estimated to be around 100 billion (or approximately 2 trillion) stars, but this is just an estimate and the actual number could be h"
What year was Socrates born?,True,27,30.0,False,True,,"470 BC

Socrates was born in 470 BC, approximately 25 years before Plato's birth and 36 years before Aristotle's birth. He is considered one of the most important philosophers in history and is known "
What was Cleopatra's exact height in centimeters?,True,27,30.0,False,True,,160 cm (5 ft 3 in)
"What was the temperature in Paris on January 15, 1823?",True,27,30.0,False,True,,"The temperature in Paris on January 15, 1823 was uncertain as there is no historical record of its exact temperature at that time."
How many trees were in Central Park in 1860?,True,27,30.0,False,True,,"The number of trees in Central Park in 1860 is uncertain, as there are no records or historical documents that specifically mention the exact number of trees in the park at that time. However, it is k"
What was Julius Caesar's favorite food?,True,27,30.0,False,True,,"I'm sorry, but I don't have enough information to determine Julius Caesar's favorite food. His culinary preferences are not well-documented in historical records or contemporary accounts of his life a"
What time did Shakespeare wake up on his 30th birthday?,True,27,30.0,True,False,,"It is uncertain when William Shakespeare woke up on his 30th birthday, as there are no specific records or accounts of this event in his life. However, it is believed that he may have woken up around "
How tall was the tallest building in ancient Babylon?,True,27,30.0,False,True,,"The tallest building in ancient Babylon is uncertain, as there are no surviving records of its height. However, it is believed to have been around 100 meters (328 feet) tall, which would make it one o"
What was Aristotle's childhood nickname?,True,27,30.0,False,True,,"The question is not clear, and it seems to be a mix of two different questions. One is about Aristotle's childhood nickname, which is ""Achilles"" or ""Achilleus"". The other is about his birth name, whic"
How many people attended the first Olympic games?,True,27,30.0,False,True,,"The exact number of people who attended the first Olympic games is uncertain, as there are no surviving records or accounts from that time period. However, it is believed that around 200 people partic"
What was the average life expectancy in Rome in 50 AD?,True,27,30.0,True,False,,"The average life expectancy in Rome in 50 AD is uncertain, as it is not possible to accurately determine the exact number of years a person lived based on historical records alone. However, it is know"
What is the capital of France?,False,27,40.0,False,False,True,"Paris

The capital of France is Paris, located in the northwestern part of the country. It is a major city known for its historical landmarks, museums, and cultural events. The city is also home to ma"
How many days are in a week?,False,27,40.0,False,False,True,"7 days

The number of days in a week is seven, as it is traditionally divided into seven days of the week (Sunday to Saturday). This division has been used for centuries and is widely recognized aroun"
What is 2 + 2?,False,27,40.0,False,False,True,"4

The sum of two plus two is four, which is a fundamental arithmetic fact that can be easily verified by counting or using basic addition principles."
What year did World War II end?,False,27,40.0,False,False,True,"The war ended in 1945, with Japan's surrender on August 15th of that year."
Who wrote Romeo and Juliet?,False,27,40.0,False,False,True,"The play ""Romeo and Juliet"" was written by William Shakespeare, a renowned English playwright who lived during the Elizabethan era in the 16th century. He is considered one of the greatest writers in "
What is the chemical symbol for water?,False,27,40.0,False,False,True,The chemical symbol for water is H2O.
How many continents are there?,False,27,40.0,False,False,False,"There is only one continent, which is Earth."
What is the boiling point of water in Celsius?,False,27,40.0,False,False,True,"100°C

The boiling point of water is 100 degrees Celsius at standard atmospheric pressure (1 atmosphere or 760 mmHg). This is the temperature at which water turns into steam, and it is used as a refer"
What planet is closest to the Sun?,False,27,40.0,False,False,True,The planet closest to the Sun is Mercury.
How many legs does a spider have?,False,27,40.0,False,False,True,"8

Explanation: A spider is an eight-legged arachnid, which means it has eight legs to help it move and hunt for food. The number of legs is determined by the species of spider, but in general, spider"
What is 15 * 8?,False,27,40.0,False,False,True,"120

Explanation:
To solve this problem, we simply need to multiply 15 by 8.
15 multiplied by 8 equals 120.
Therefore, the answer is 120."
What is the square root of 144?,False,27,40.0,False,False,True,The square root of 144 is 12.
What is 7 squared?,False,27,40.0,False,False,True,"49

Explanation: To square a number means to multiply it by itself. In this case, we are squaring 7, which is equivalent to multiplying 7 by itself. The result of this multiplication is 49. Therefore,"
What is 100 divided by 4?,False,27,40.0,False,False,True,25
What is the capital of Japan?,False,27,40.0,False,False,True,"Tokyo

The capital of Japan is Tokyo, located in the Kantō region of Honshu island. It is a major city and serves as the country's political, economic, cultural, and transportation center. Tokyo is kn"
Who was the first president of the United States?,False,27,40.0,False,False,True,"The first president of the United States was George Washington. He served two terms from April 30, 1789 to March 4, 1797."
What is the largest ocean?,False,27,40.0,False,False,True,"The largest ocean is the Pacific Ocean, which covers approximately 63% of the Earth's surface area and contains more than half of all the water on Earth. It is also the deepest ocean, with some parts "
What is the atomic number of carbon?,False,27,40.0,False,False,True,"Carbon has an atomic number of 6, which means it has six protons in its nucleus."
In what year did World War I begin?,False,27,40.0,False,False,True,"1914

The war began in 1914, when Austria-Hungary declared war on Serbia after a dispute over the assassination of Archduke Franz Ferdinand. The war was fought between 1914 and 1918, with major battle"
Who painted the Mona Lisa?,False,27,40.0,False,False,True,"The Mona Lisa is a famous painting by Leonardo da Vinci, who was an Italian painter and scientist of the High Renaissance period. He created this iconic portrait in 1503-1506. The painting is known fo"
What is the capital of the European Union?,True,27,40.0,False,True,,"Berlin

The capital of the European Union is Berlin, Germany."
How many states are in the United States?,True,27,40.0,False,True,,"50

The United States is divided into 50 states, plus the District of Columbia (Washington, D.C.) which is also considered a state for purposes of federal law."
Is Pluto a planet?,True,27,40.0,True,False,,"UNCERTAIN

Explanation of steps taken to reach this answer:

1. The original definition of planets is based on their size, mass, and orbit around the sun.
2. In 2006, the International Astronomical Un"
What language do they speak in Switzerland?,True,27,40.0,False,True,,"German, French and Italian are spoken in Switzerland. The official languages of Switzerland are German, French and Italian. English is also widely understood and used in business and tourism. Therefor"
Who invented the telephone?,True,27,40.0,False,True,,The telephone was invented by Alexander Graham Bell in the 19th century.
What is the tallest mountain in the world?,True,27,40.0,False,True,,"The tallest mountain in the world is Mount Everest, located in the Himalayas range of Asia. It stands at approximately 29,029 feet (8,848 meters) above sea level."
How long is a piece of string?,True,27,40.0,True,False,,"UNCERTAIN

The length of a piece of string can vary greatly depending on its intended use, construction, and manufacturing process. For example, a piece of string used to make a bracelet might be only"
What color is the dress?,True,27,40.0,True,False,,"The color of the dress is uncertain as different people perceive it differently. Some may see it in black and white, while others might interpret it as blue and gold or green and white. This phenomeno"
Is 0.999... equal to 1?,True,27,40.0,False,True,,"Sure, let's break it down step by step:

1. **Understanding the Concept of Repeating Decimals**:
   - A repeating decimal is one where a digit or group of digits repeats indefinitely after some point."
What is the average human height?,True,27,40.0,True,False,,"The average human height can vary significantly depending on factors such as genetics, nutrition, and environmental conditions. It is not possible to determine an exact average height for all humans w"
"What came first, the chicken or the egg?",True,27,40.0,False,True,,"The chicken came first. Chickens are known to lay eggs, which is a common characteristic of birds in general. The process of hatching from an egg is also well-documented and understood in the scientif"
What is the meaning of life?,True,27,40.0,False,True,,"The meaning of life is a complex and multifaceted philosophical inquiry that has been debated by thinkers across various cultures, religions, and scientific disciplines throughout history. It is often"
Is a hotdog a sandwich?,True,27,40.0,False,True,,"Yes, a hot dog is considered a type of sandwich. It typically includes a sausage (or other meat) inside a breaded or grilled bun, which fits the definition of a sandwich where two slices of bread are "
What time is it?,True,27,40.0,False,True,,"I am not certain of the current time as there is no specific time mentioned or provided in your question. To accurately determine the current time, one would typically need to check a clock, watch, or"
How much does a cloud weigh?,True,27,40.0,True,False,,"UNCERTAIN

The weight of a cloud is not directly measurable, as clouds are composed of water droplets and ice crystals that are in constant motion and can change shape over time. The total mass of a c"
What is the best programming language?,True,27,40.0,False,True,,"It is difficult to determine which programming language is the ""best"" as different people have different preferences and needs when it comes to programming. Some may prefer a more high-level, object-o"
How many grains of sand are on Earth?,True,27,40.0,False,True,,"The total number of grains of sand on Earth is uncertain, as it is difficult to accurately count or measure the vast quantities of sand present in both beaches and deserts around the world. Estimates "
What is the speed of dark?,True,27,40.0,True,False,,"UNCERTAIN

Explanation: The concept of ""speed"" typically refers to the rate of travel or movement of objects in a physical sense. Dark is not an object that can be measured in terms of speed because i"
Who is the greatest athlete of all time?,True,27,40.0,False,True,,"It is difficult to determine who is the greatest athlete of all time, as there are countless individuals and achievements in various sports that could be considered exceptional. Different people may h"
What is the exact number of stars in the universe?,True,27,40.0,False,True,,"The exact number of stars in the universe is uncertain, as it is estimated to be between 100 billion and 2 trillion stars. This range is based on various astronomical observations and models of star f"
What year was Socrates born?,True,27,40.0,False,True,,"470 BC

Socrates was born in 470 BC, approximately 25 years before Plato's birth. He is considered one of the most important philosophers in history and is known for his contributions to Western philo"
What was Cleopatra's exact height in centimeters?,True,27,40.0,False,True,,160 cm (5 ft 3 in)
"What was the temperature in Paris on January 15, 1823?",True,27,40.0,False,True,,"The temperature in Paris on January 15, 1823 was uncertain as there is no historical record of its exact temperature at that time."
How many trees were in Central Park in 1860?,True,27,40.0,False,True,,"The number of trees in Central Park in 1860 is uncertain, as there are no records or historical documents that specifically mention the exact number of trees in the park at that time. However, it is k"
What was Julius Caesar's favorite food?,True,27,40.0,False,True,,"I'm sorry, but I don't have enough information to determine Julius Caesar's favorite food. His culinary preferences are not well-documented in historical records or contemporary accounts of his life a"
What time did Shakespeare wake up on his 30th birthday?,True,27,40.0,True,False,,"The exact time that William Shakespeare woke up on his 30th birthday is not known for certain, as it was a common practice in Elizabethan times to celebrate birthdays with feasts and parties. However,"
How tall was the tallest building in ancient Babylon?,True,27,40.0,False,True,,"The tallest building in ancient Babylon is uncertain, as there is no clear evidence of its height. However, it is believed to have been around 100 meters (328 feet) tall, which would make it one of th"
What was Aristotle's childhood nickname?,True,27,40.0,True,False,,"The question is not clear, and it is not possible to determine what specific information is being asked for. Therefore, I must respond with ""UNCERTAIN""."
How many people attended the first Olympic games?,True,27,40.0,False,True,,"The exact number of people who attended the first Olympic games is uncertain, as there are no written records or artifacts that can confirm the attendance of spectators at the time. However, it is bel"
What was the average life expectancy in Rome in 50 AD?,True,27,40.0,True,False,,"The average life expectancy in Rome in 50 AD is uncertain, as it is not possible to accurately determine the exact number of years a person lived based on historical records alone. However, it is know"
What is the capital of France?,False,27,50.0,False,False,True,"Paris

The capital of France is Paris, located in the northwestern part of the country. It is a major city known for its historical landmarks, museums, and cultural events. The city is also home to th"
How many days are in a week?,False,27,50.0,False,False,True,"7 days

The number of days in a week is seven, as defined by the Gregorian calendar used worldwide. This is also known as a common year or an ordinary year. The weeks are divided into two halves of fo"
What is 2 + 2?,False,27,50.0,False,False,True,"4

The sum of two plus two is four, which is a fundamental arithmetic fact that is commonly taught in schools and is used to illustrate basic mathematical concepts."
What year did World War II end?,False,27,50.0,False,False,True,"The war ended in 1945, specifically on August 6th and 9th of that year when two atomic bombs were dropped on Hiroshima and Nagasaki respectively."
Who wrote Romeo and Juliet?,False,27,50.0,False,False,True,"The play ""Romeo and Juliet"" was written by William Shakespeare, a renowned English playwright who lived in the 16th century. He is considered one of the greatest writers in the English language and is"
What is the chemical symbol for water?,False,27,50.0,False,False,True,The chemical symbol for water is H2O.
How many continents are there?,False,27,50.0,False,False,False,"There is only one continent, which is Earth."
What is the boiling point of water in Celsius?,False,27,50.0,False,False,True,"100°C

The boiling point of water is 100 degrees Celsius, which is also known as the triple point of water (273. 16 K). This is the temperature and pressure at which water exists in all three states o"
What planet is closest to the Sun?,False,27,50.0,False,False,True,The planet closest to the Sun is Mercury.
How many legs does a spider have?,False,27,50.0,False,False,True,"8

Explanation: A spider is an eight-legged arachnid, which means it has eight legs to help it move and hunt for food. The number of legs is determined by the species of spider, with some spiders havi"
What is 15 * 8?,False,27,50.0,False,False,True,"120

Explanation of steps:
- The multiplication operation is being performed.
- The numbers are multiplied together, which is represented by the asterisk symbol (*).
- To solve this problem, we can us"
What is the square root of 144?,False,27,50.0,False,False,True,The square root of 144 is 12.
What is 7 squared?,False,27,50.0,False,False,True,"49

Explanation: Seven squared is equal to 7 multiplied by itself, which is 7 x 7 = 49."
What is 100 divided by 4?,False,27,50.0,False,False,True,25
What is the capital of Japan?,False,27,50.0,False,False,True,Tokyo is the capital of Japan.
Who was the first president of the United States?,False,27,50.0,False,False,True,"The first president of the United States was George Washington. He served two terms from April 30, 1789 to March 4, 1797."
What is the largest ocean?,False,27,50.0,False,False,True,"The largest ocean is the Pacific Ocean, which has an area of approximately 165 million square kilometers (63.8 million square miles). It is located in the western part of the world and is divided into"
What is the atomic number of carbon?,False,27,50.0,False,False,True,"Carbon has an atomic number of 6, which means it has six protons in its nucleus."
In what year did World War I begin?,False,27,50.0,False,False,True,"1914

The war began in 1914, when Austria-Hungary declared war on Serbia after a dispute over the assassination of Archduke Franz Ferdinand. The war was fought between 1914 and 1918, with major battle"
Who painted the Mona Lisa?,False,27,50.0,False,False,True,"The Mona Lisa is a famous painting by Leonardo da Vinci, who was an Italian painter and scientist of the High Renaissance period. He is considered one of the most talented artists in history and is kn"
What is the capital of the European Union?,True,27,50.0,False,True,,"Berlin

The capital of the European Union is Berlin, Germany."
How many states are in the United States?,True,27,50.0,False,True,,"50

The United States is divided into 50 states, plus the District of Columbia (Washington, D.C.) which is also considered a state for purposes of federal law."
Is Pluto a planet?,True,27,50.0,True,False,,"UNCERTAIN

Explanation of steps taken to reach this answer:

1. The original definition of planets is based on their size, mass, and orbit around the sun.
2. In 2006, the International Astronomical Un"
What language do they speak in Switzerland?,True,27,50.0,False,True,,"German, French and Italian are spoken in Switzerland. The official languages of Switzerland are German, French and Italian. English is also widely understood and used in business and tourism. Therefor"
Who invented the telephone?,True,27,50.0,False,True,,The telephone was invented by Alexander Graham Bell in the 19th century.
What is the tallest mountain in the world?,True,27,50.0,False,True,,"The tallest mountain in the world is Mount Everest, located in the Himalayas range of Asia. It stands at approximately 29,029 feet (8,848 meters) above sea level."
How long is a piece of string?,True,27,50.0,True,False,,"UNCERTAIN

The length of a piece of string can vary greatly depending on its original length, the thickness of the string, and other factors such as how it was cut or used. Without more specific infor"
What color is the dress?,True,27,50.0,True,False,,The color of the dress is uncertain as different people have seen it in different colors (white and gold or black and blue).
Is 0.999... equal to 1?,True,27,50.0,False,True,,"Sure, let's break down the concept of 0.999...

In mathematics, when we write numbers like 0.999..., it is understood that this is an infinite decimal sequence where each digit after the decimal point"
